id,title,emoji,number,description,tips
1,Police,🚔,112,"24/7 emergency police line. English interpretation available.","Say 'I need English' — they connect you to an interpreter within seconds."
2,Fire & Ambulance,🚑,119,"Fire department and ambulance. Also handles medical emergencies.","State your location clearly. Google Maps can show your exact address in English."
3,Korea Travel Helpline,✈️,1330,"Tourist-specific helpline. Available in English, Chinese, Japanese, and more.","Best first call for non-emergency travel issues: scams, lost items, complaints."
4,Emergency Medical Info,🏥,1339,"24/7 medical advice and hospital guidance in multiple languages.","Tells you the nearest open hospital or pharmacy at any hour."
5,Lost & Found (Police),🔍,182,"Report lost belongings or theft to the national lost property center.","File a report online at Lost112.go.kr — also available in English."
